id,user,date,timestamp,commentText,likes,hasReplies,numberOfReplies,replies.id,replies.user,replies.date,replies.timestamp,replies.commentText,replies.likes
,,,,,,,,UgiKbXccCS6RuHgCoAEC.8Ly6tJDhSW68M-SYatv2gN,Eli Castro,1 year ago,1508020810701,Baby G thanks,0
UgisDRaHYJ7_c3gCoAEC,Lauren Lewis,1 year ago,1508020810070,I feel like this was inspiration for crybaby or at least mad hatter😂😂you could tell from then what her music would sound like,11,false,0,,,,,,
Ugg-9k4Ehk77CHgCoAEC,Tanguy Sims,1 year ago,1508020810073,😍,2,false,0,,,,,,
UghC9WM4q5fx63gCoAEC,tymarrie,1 year ago,1508020810075,That moment when you realize that Melanie was 17 here,14,false,0,,,,,,
UghC6TlFCeJHFngCoAEC,Ana Clara Antunes Calegari,1 year ago,1508020810077,"MEU DEUS essa Mel é muito ninja , toca pandero com o pé, toca violão, piano mdsssssssss",0,true,1,,,,,,
,,,,,,,,UghC6TlFCeJHFngCoAEC.8LpM4tcMAXc8MBw9sabT96,Marcos Yamaguchi,1 year ago,1508020810791,Ana Clara Antunes Calegari Vdd,0
Ughmj5czs0CADngCoAEC,Micah Douma,1 year ago,1508020810080,I love her music,1,false,0,,,,,,
UggAy2sf2gIyungCoAEC,caroline son,1 year ago,1508020810083,"Melanie: ""well I think ur crazyyyyy""
Me: ""the best people are"" 
All u cry babies will understand ;)",20,false,0,,,,,,
UghXe7HgZjQ-UngCoAEC,Raven Reeves,1 year ago,1508020810085,she is so pretty,0,false,0,,,,,,
UgiEY45jbe1iQXgCoAEC,Jamie Wright,1 year ago,1508020810087,"If you look at Adam in all the videos on Melanie on the voice, he just looks so into it like he really loves her voice",61,true,2,,,,,,
,,,,,,,,UgiEY45jbe1iQXgCoAEC.8LnTh0tfj6l8MMQNj_fojN,Evan Roberson,1 year ago,1508020810775,literally the exact face I make while listening to her xD,3
,,,,,,,,UgiEY45jbe1iQXgCoAEC.8LnTh0tfj6l8MvE6N0sBzc,Hope Everlasting,1 year ago,1508020810778,Jamie Wright s,0
Ugjth4Jv0PkBDHgCoAEC,ɾ σ ψ α ʆ ɕ α ϯ ς,1 year ago,1508020810091,WOWWWW,2,false,0,,,,,,
UggzVkYMshfy8ngCoAEC,Phan Girl,1 year ago,1508020810093,Is it just me that wants Melanie to come back to the voice and sing one of her songs?😐,177,true,2,,,,,,
,,,,,,,,UggzVkYMshfy8ngCoAEC.8LgIkM7CYQZ8LkMD4jRw_R,Phan Girl,1 year ago,1508020810728,Epic Mango2006 yay 😊 I'm not alone!,3
,,,,,,,,UggzVkYMshfy8ngCoAEC.8LgIkM7CYQZ8aeUIZFvZpR,Panic at the my chemical piløts,9 months ago,1515969610730,Phan Girl yoo not alone,2
UgiFWgq_YPhMoHgCoAEC,Trashy Human 101,1 year ago,1508020810097,Is it bad I didn't know Melanie Martinez was on the voice???,13,true,1,,,,,,
,,,,,,,,UgiFWgq_YPhMoHgCoAEC.8LfIlg6By1Y8Ll47XPDvED,Shrek’s Swamp,1 year ago,1508020810736,GamingGirl4Life MSP I didn't even know either,5
UgiMvzvd5-nJeXgCoAEC,Eddie Mercado,1 year ago,1508020810100,i love the voice and she pertty,0,false,0,,,,,,
UgiV3-0LsewSiXgCoAEC,Random Person,1 year ago,1508020810102,"i went to find it on apple music.... BITCH IT AIN'T THERE, WHY?!",1,false,0,,,,,,
UggD90jI12GFYXgCoAEC,Sanaa Sisson,1 year ago,1508020810105,She should have won that season but I guess that's my opinion,13,false,0,,,,,,
UggdCu0S1QgFCngCoAEC,Queen Rose Wakeel,1 year ago,1508020810107,Forcing that voice out😒 gonna be attacked in 0.0000001 seconds,0,false,0,,,,,,
UghfLBM5kJNReXgCoAEC,Jenny x kpop JS,1 year ago,1508020812955,Every song sounds better when Melanie sings it,709,true,12,,,,,,
,,,,,,,,UghfLBM5kJNReXgCoAEC.8LcfBw_b8ZI8LzeeIkoU67,Stanley Wong,1 year ago,1508020813533,For this song? NEVER,8
,,,,,,,,UghfLBM5kJNReXgCoAEC.8LcfBw_b8ZI8MPTvgiT46M,whatever nevermind,1 year ago,1508020813535,XxLiLibooxX AS true :D,0
,,,,,,,,UghfLBM5kJNReXgCoAEC.8LcfBw_b8ZI8MXXGHyMPni,Olivia Spencer,1 year ago,1508020813537,She did well.,2
,,,,,,,,UghfLBM5kJNReXgCoAEC.8LcfBw_b8ZI8NUlMdKl_nk,ʀᴏɢᴜᴇᴏғʟɪғᴇ,1 year ago,1508020813539,"XxLiLibooxX AS Except for Starring Role, Marina is my lord and savior.",4
,,,,,,,,UghfLBM5kJNReXgCoAEC.8LcfBw_b8ZI8NrMzIL7Ie5,Kadin Pratt,1 year ago,1508020813541,XxLiLibooxX AS no kitten,0
,,,,,,,,UghfLBM5kJNReXgCoAEC.8LcfBw_b8ZI8NwiHHIfZDi,shaelan k,1 year ago,1508020813543,XxLiLibooxX AS YES,1
,,,,,,,,UghfLBM5kJNReXgCoAEC.8LcfBw_b8ZI8O5UqSb4iCT,jalynn,1 year ago,1508020813545,XxLiLibooxX AS yeah I geuss it does,0
,,,,,,,,UghfLBM5kJNReXgCoAEC.8LcfBw_b8ZI8QM920b-O0c,Larry Johnson,1 year ago,1508020813547,"Nah...This is one of the few exceptions.  I think Gnarls sings it better.  Most the other songs Melanie sung were great, though, for sure.",3
,,,,,,,,UghfLBM5kJNReXgCoAEC.8LcfBw_b8ZI8QNzs646JkI,Clawdeen Wolf,1 year ago,1508020813549,XxLiLibooxX AS IKR,0
,,,,,,,,UghfLBM5kJNReXgCoAEC.8LcfBw_b8ZI8SF6qmikwYV,Luelluna,1 year ago,1508020813551,"Jennifer Sanders AS  I don't agree. She sang it well, but this song is not for her.",5
,,,,,,,,UghfLBM5kJNReXgCoAEC.8LcfBw_b8ZI8TCplt2Qxtw,Bella M,1 year ago,1508020813553,Stanley Wong I completely agree,0
,,,,,,,,UghfLBM5kJNReXgCoAEC.8LcfBw_b8ZI8f1XhIEypn_,erik,6 months ago,1523745613555,so damn true,0
UghBm8V1QNnndHgCoAEC,Manuella J,1 year ago,1508020812958,"I really like Melanie, but this songs dosent make her sound that good. Is it just me v",0,false,0,,,,,,
UghjAfm1Hpolt3gCoAEC,definetely not siren's alt account um,1 year ago,1508020812961,i would vote like 12983719827381127932 times for her.,289,true,9,,,,,,
,,,,,,,,UghjAfm1Hpolt3gCoAEC.8LaT9yvMngl8M4qXQPR1YI,sofiaa,1 year ago,1508020813579,Wai LPS about a trillion times 😂 same,5
,,,,,,,,UghjAfm1Hpolt3gCoAEC.8LaT9yvMngl8NMukER5v_e,aespugic,1 year ago,1508020813581,Crybaby YT I would vote 987654321987654321987654321987654321987654321987654321987654321987654321987654321987654321987654321987654321987654321987654321987654321987654321987654321987654321987654321987654321987654321987654321987654321987654321987654321987654321987654321987654321987654321987654321987654321987654321987654321987654321987654321987654321987654321987654321987654321987654321987654321987654321987654321987654321987654321987654321987654321987654321987654321987654321987654321987654321987654321987654321987654321987654321987654321987654321987654321987654321987654321987654321987654321987654321987654321987654321987654321987654321987654321987654321987654321987654321987654321987654321987654321987654321987654321987654321987654321987654321987654321987654321987654321987654321987654321987654321987654321987654321987654321987654321987654321 times Lol,2
,,,,,,,,UghjAfm1Hpolt3gCoAEC.8LaT9yvMngl8NNn-I-KJjT,sofiaa,1 year ago,1508020813583,ThePugTDM Same thooo,0
,,,,,,,,UghjAfm1Hpolt3gCoAEC.8LaT9yvMngl8NRA0EXTqHN,Bluestea,1 year ago,1508020813585,Wai LPS ill vote ∞ times to her,3
,,,,,,,,UghjAfm1Hpolt3gCoAEC.8LaT9yvMngl8NfqD1xR5MG,Emma 5157,1 year ago,1508020813587,Same 😂❤️,2
,,,,,,,,UghjAfm1Hpolt3gCoAEC.8LaT9yvMngl8NrN6W1Q8W3,Kadin Pratt,1 year ago,1508020813589,Wai LPS I would like to vote 99999999999999999999999999999999999999999999999999999999.1 times,5
,,,,,,,,UghjAfm1Hpolt3gCoAEC.8LaT9yvMngl8NyXeBOQo63,Cotton Candy,1 year ago,1508020813590,Wai LPS I would vote 9999999999999999999999999999997999999999999799999999999959999999999999999999,2
,,,,,,,,UghjAfm1Hpolt3gCoAEC.8LaT9yvMngl8SMUXUtj6Yt,Ninja Kitty,1 year ago,1508020813592,Wai LPS Zi wouod vote101010101001010373728191938847484999999383716171902039281726384939911771718191928×6626627282929292666619188282288282822882828244446661828292948474746464646464663362772739999999999910101010101010101020202010101101010100101010101101001.....12937474729919283747474838292919183747474742992944*7474839301(breaks keyboard) 29293838e7r737e73732i828822992929292292929 TIMES FOR HER WAIT MORE ×8383737r746473737373377373737372727282892922929899999,0
,,,,,,,,UghjAfm1Hpolt3gCoAEC.8LaT9yvMngl8TLHCTnDRUi,Livvy9hundred,1 year ago,1508020813594,"I would vote 99999999999999999999999999999999999999999999999999999999999999999999999999999999999999999999999999999999999999999999999999999999999999999999999999999999999999999999999999999999999999999999999999999999999995964596485694856499997693485793485793863769458674958694999999999876938573945873469879385792587594875396487394867958762395704678496879348732984679385791287946797698479237594875934875938547987934432442332234423324234324986969696996966976978787669976967967962399994321367539999999999999203529582590384923849899999999999999999999999999999999999999999999999999999999999999999999999999999999999999999999999993547650946894859189898989999999999999999999999999999999898989898989898989898989898989898989898989898989898989898989898989898989898989898989898989898989898989898989898989898989898989898989898989898989898 X 827492873598275987845938475938475934875395870909898767576465465476578769879064534876284768735683659857938579098249340902439502930453098024820398402939834769485943024379856983749238749234872938420390429385203985039485982375928375739045909920931840217498724918279812847192847923879238759238579385723958792874593899999999998799898978989789787987978798798797879879787987978797897897879879879879789787978968796879689789687956879568795879586797859879587985798649864986498469847984984968986498469846984698468946986498469846986986498987498498464689986985395839853985389359853983598358953985398539853983598358935985398986498648998539835988
I would write more but I think I just broke all the numbers on my keyboard.",1
UghBEbtbV0aOX3gCoAEC,Aj Mcdonald,1 year ago,1508020812964,Her voice is weak af like Stephanie Baka from the X factor,0,true,3,,,,,,
,,,,,,,,UghBEbtbV0aOX3gCoAEC.8LaSn7Xse4U8LalHhvBs0p,Elizabeth Santome,1 year ago,1508020813426,do realize how long ago this was,1
,,,,,,,,UghBEbtbV0aOX3gCoAEC.8LaSn7Xse4U8LqF8yegRsl,Aj Mcdonald,1 year ago,1508020813428,She now has some range still not great she just has a unique voice not a big voice if she was on the X factor she would have got out week 4 and would've faced the bottom 2 more then once,0
,,,,,,,,UghBEbtbV0aOX3gCoAEC.8LaSn7Xse4U8MMQmTmYg9K,Xavier Manzanares,1 year ago,1508020813430,Uzair Sarfaraz How bout you upload a vid of you singing cause I bet you will sound like a dolphin dying .,0
UgjNm3XezeJlongCoAEC,Sadye is obsessed with bands,1 year ago,1508020812967,that pink little piano is like giving everyone a hint for crybaby. XD,1,false,0,,,,,,
Ugg1bC-_rm4WSXgCoAEC,Aceita Que Doi Menos,1 year ago,1508020812969,Divaaaa -,1,false,0,,,,,,
UghHnUcKtxL0lXgCoAEC,kelly Vilk,1 year ago,1508020812972,she did an awesome job,9,false,0,,,,,,
UgiEcxuNwWY35XgCoAEC,lbbh myriaa,1 year ago,1508020812974,insn't that the other guy song,1,false,0,,,,,,
UggbTYqbfM-KXngCoAEC,yanny Otouto,1 year ago,1508020812977,a melanie não tomava sol?,0,true,2,,,,,,
,,,,,,,,UggbTYqbfM-KXngCoAEC.8LVrPwSP8UL8LW52dn7DmZ,Joyce Afonso,1 year ago,1508020813366,omg kkkkkk,0
,,,,,,,,UggbTYqbfM-KXngCoAEC.8LVrPwSP8UL8LW5M-2ZnVd,yanny Otouto,1 year ago,1508020813368,ela parece q nem tem sangue,0
UggGI4jQucMk23gCoAEC,mack,1 year ago,1508020812980,Did she win!?,0,true,1,,,,,,
,,,,,,,,UggGI4jQucMk23gCoAEC.8LUXhvKDXwy8LUc9rGTSwg,Sophia Sulzer,1 year ago,1508020813385,"YourLocalMack no, she got sixth and this was a year ago",0
Uggf4F4IrFMNWXgCoAEC,Tori Madden,1 year ago,1508020812983,She's flat,0,true,1,,,,,,
,,,,,,,,Uggf4F4IrFMNWXgCoAEC.8LSeYX2bCO98LSuoAm-FsF,Noa D. G,1 year ago,1508020813461,Tori what do you mean flat?,1
Ugj7HJBFQfP-tHgCoAEC,Michelle Barone,1 year ago,1508020812986,this is not one of her normal  kind of songs,0,true,2,,,,,,
,,,,,,,,Ugj7HJBFQfP-tHgCoAEC.8LRipZFp3hG8LRpKkqNndR,Mabel Pines,1 year ago,1508020813454,Michelle Barone its not her song its a cover,21
,,,,,,,,Ugj7HJBFQfP-tHgCoAEC.8LRipZFp3hG8LVZ2nrYvx2,Flimpeen Flarmpoon,1 year ago,1508020813456,How have you not heard the original?,1
UggnTKS7-uQD4XgCoAEC,Aimee MSP XD,1 year ago,1508020812989,Perfect 😘,2,false,0,,,,,,
Ugio1NQimDtUpHgCoAEC,Nazgul Istakeeva,1 year ago,1508020812991,I cant believe she came 6th! I mean she's amazing I know she hasn't got a powerful voice like Demi or Ari but a soothing voice like Selena!,24,true,1,,,,,,
,,,,,,,,Ugio1NQimDtUpHgCoAEC.8LR9GjWo7RF8LaixuJQIep,Mya J,1 year ago,1508020813393,selena has no technique what so ever. Melanie can actually carry a tune.,26
Ugh8G9wWWwERQHgCoAEC,Lesley kings,1 year ago,1508020812994,Realizing I actually know these songs,27,false,0,,,,,,
UgimZZHZugUjrXgCoAEC,Aaliyah Roberson,1 year ago,1508020812997,Her voice has become so much stronger,34,false,0,,,,,,
UgiFtwWTVYf25ngCoAEC,loser 4lyfe,1 year ago,1508020812999,"she's wayyy better without auto-tune, like if u agree",0,false,0,,,,,,
UgjiVVCyBW4Q4XgCoAEC,Katie Dezes,1 year ago,1508020813002,"Am I the only one that thinks she can't sing at all? Her voice always sounds weak, and she can never stay on key. But apparently having a cute hairstyle and a quirky personality makes up for that?",1,true,1,,,,,,
,,,,,,,,UgjiVVCyBW4Q4XgCoAEC.8LJM2XmJ9V08LJut-P40Ov,Bella T,1 year ago,1508020813419,"Katie Dezes like Melanie said ""I think ur crazy!"" 😂😂😂 we all are entitled to our own opinion",0
Ugjv0H20t3q_6HgCoAEC,lil.tater,1 year ago,1508020813006,Melanie will always be an inspiration to me.,13,false,0,,,,,,
UghNrimUgPaiW3gCoAEC,Mad Cry Baby,1 year ago,1508020813008,divaaa ♥♡♥,2,false,0,,,,,,
UgjNGncLKYDUGXgCoAEC,silvano augusto,1 year ago,1508020814480,o the Voice Brasil deveria ser tão bom quanto o americano e o britânico pois tem os mesmos formatos,2,false,0,,,,,,
UgiZEnQjNGjhGngCoAEC,Kaitlyn,1 year ago,1508020814483,I love how many people r watching this today.,386,true,6,,,,,,
,,,,,,,,UgiZEnQjNGjhGngCoAEC.8LCLiqqvQtS8LHy0x_mqwl,Space Unicorns,1 year ago,1508020815062,Kaitlyn Yup!!,3
,,,,,,,,UgiZEnQjNGjhGngCoAEC.8LCLiqqvQtS8NZFFm06QUd,DrawingAThing,1 year ago,1508020815064,Kaitlyn yashh,0
,,,,,,,,UgiZEnQjNGjhGngCoAEC.8LCLiqqvQtS8NeqQJAFl_h,rexor ibe,1 year ago,1508020815066,"They are both good singers (Christina Grimmie <3) but christina's dead now, so the popularity goes to melanie :(",2
,,,,,,,,UgiZEnQjNGjhGngCoAEC.8LCLiqqvQtS8OpFJfTlDAw,ahmed hanafi,1 year ago,1508020815067,please she participated  in which year ?,0
,,,,,,,,UgiZEnQjNGjhGngCoAEC.8LCLiqqvQtS8WwWUn9BEQw,BEEF,1 year ago,1508020815069,ahmed hanafi 2012,0
,,,,,,,,UgiZEnQjNGjhGngCoAEC.8LCLiqqvQtS8aWru0KIB4B,leslie j,9 months ago,1515969615070,Kaitlyn right,0
UggtrLR7Y2nwangCoAEC,Luca Uttó,1 year ago,1508020814487,OMG. Melanie singing my favorite song. Impossible.,26,true,1,,,,,,
,,,,,,,,UggtrLR7Y2nwangCoAEC.8LAhKWiNASB8LHy83DBhPF,Space Unicorns,1 year ago,1508020815004,Luca Uttó possible :3,0
UgitP44awYCAGngCoAEC,Hfgddssfff C,1 year ago,1508020814491,I JUST REALIZED SHE WAS PLAYING THE LITTLE PIANO NEXT TO HER🙊🙊🙊,1345,true,11,,,,,,
,,,,,,,,UgitP44awYCAGngCoAEC.8LAcw_T4-558LFAFh72OHn,Silverio Salazar,1 year ago,1508020815091,Melanies Teddy Bears WOAH WITH ONE HAND I CAN'T DO DAT!,11
,,,,,,,,UgitP44awYCAGngCoAEC.8LAcw_T4-558LSd7r7jbkE,Where Is Luna?,1 year ago,1508020815092,At around 1:24 she takes her hand off the piano but it keeps playing.,57
,,,,,,,,UgitP44awYCAGngCoAEC.8LAcw_T4-558M1TtLi5yqe,cassie haulman,1 year ago,1508020815094,yeah she is playing it she takes her hand off and it keeps playing she just does it for show,23
,,,,,,,,UgitP44awYCAGngCoAEC.8LAcw_T4-558MxS0sb0Cbz,carleigh mack,1 year ago,1508020815096,Where Is Luna? maybe it's a loop pedal,10
,,,,,,,,UgitP44awYCAGngCoAEC.8LAcw_T4-558O6-TWFkSRE,tu mama no te quiere,1 year ago,1508020815098,Kool Koala Gaming It's on loop so she plays it and it keeps repeating.,12
,,,,,,,,UgitP44awYCAGngCoAEC.8LAcw_T4-558Osl_tCMGAN,L'il Hodgy,1 year ago,1508020815099,Hfgddssfff Yeah,2
,,,,,,,,UgitP44awYCAGngCoAEC.8LAcw_T4-558OwNewd8NPF,Fabulous Skits,1 year ago,1508020815101,Hfgddssfff C really,2
,,,,,,,,UgitP44awYCAGngCoAEC.8LAcw_T4-558XckEs1hgj_,Yuri Gacha Studio,1 year ago,1508020815103,Hfgddssfff C- O̤̮M̤̮G̤̮ s̤̮a̤̮m̤̮e̤̮,1
,,,,,,,,UgitP44awYCAGngCoAEC.8LAcw_T4-558bFB_CT7qhg,Jassy J,9 months ago,1515969615104,Hfgddssfff C   NO,0
,,,,,,,,UgitP44awYCAGngCoAEC.8LAcw_T4-558bFBestp237,Jassy J,9 months ago,1515969615106,No really,0
,,,,,,,,UgitP44awYCAGngCoAEC.8LAcw_T4-558eORMvzYEnz,Anime Sans,6 months ago,1523745615107,Hfgddssfff C FUUUUUUUUUUUUUUUMP!!!,0
UggaoLuOARt5o3gCoAEC,Tiffany G,1 year ago,1508020814495,She looks so fucking good😩❤️❤️❤️,0,false,0,,,,,,
Uggu5-w6E-tenHgCoAEC,Siany Shoo,1 year ago,1508020814498,mannequin challenge,30,false,0,,,,,,
Uggz9mJ_qKpT-XgCoAEC,olivia lmao,1 year ago,1508020814501,"Yes it makes you crazy, but so what if you're crazy, all the best people are",0,false,0,,,,,,
UghND6-fexwU-ngCoAEC,Iliana,1 year ago,1508020814504,Why is she so amazing omg I love her so much I listen to her music everyday ❤️❤️❤️🍼😍😭👌🏼,9,false,0,,,,,,
UgjFu3Tc2It813gCoAEC,katelyn martin,1 year ago,1508020814507,Can I marry her pls,24,true,7,,,,,,
,,,,,,,,UgjFu3Tc2It813gCoAEC.8L96yuFexRA8LFAK8z2p89,Silverio Salazar,1 year ago,1508020815017,katelyn martin uhhhh...,1
,,,,,,,,UgjFu3Tc2It813gCoAEC.8L96yuFexRA8LHyDi-FU0Y,Space Unicorns,1 year ago,1508020815018,To her boyfriend,1
,,,,,,,,UgjFu3Tc2It813gCoAEC.8L96yuFexRA8M-Y7511i5X,; -ocean- ;,1 year ago,1508020815020,"i don't think she's lez
judging that ur name is katelyn",0
,,,,,,,,UgjFu3Tc2It813gCoAEC.8L96yuFexRA8M-aLxaNmgD,Space Unicorns,1 year ago,1508020815022,Yeah Um ya °-°,0
,,,,,,,,UgjFu3Tc2It813gCoAEC.8L96yuFexRA8M-kuRkejAw,katelyn martin,1 year ago,1508020815023,I'm not actually lesbian lol it's a girl thing,0
,,,,,,,,UgjFu3Tc2It813gCoAEC.8L96yuFexRA8M-mtiZmfi2,; -ocean- ;,1 year ago,1508020815025,@katelyn martin im a girl tho... i forgot I'm called wifey by my friend xD oops lol,0
,,,,,,,,UgjFu3Tc2It813gCoAEC.8L96yuFexRA8MEuCKR_oGX,ღTuned Awesomeღ,1 year ago,1508020815026,"katelyn martin eh...
I'm a girl... And younger... But yes I agree I NEED TO AT LEAST MEET HER",2
UggjNiEdBm2P4ngCoAEC,Daphne Divina,1 year ago,1508020814511,i love your voice,0,false,0,,,,,,
UgjWxryXNXTg73gCoAEC,Joyce Lambert,1 year ago,1508020814513,I'm in love with her voice,360,true,5,,,,,,
,,,,,,,,UgjWxryXNXTg73gCoAEC.8L7557oW4Zc8LFAI60KGKl,Silverio Salazar,1 year ago,1508020814924,Joyce Lambert yea,7
,,,,,,,,UgjWxryXNXTg73gCoAEC.8L7557oW4Zc8MykOUMxAwj,ImSoFuckingRandom Hahaha,1 year ago,1508020814925,im in love with her period,11
,,,,,,,,UgjWxryXNXTg73gCoAEC.8L7557oW4Zc8Np1GLXP9zx,wild,1 year ago,1508020814927,"ImSoFuckingRandom Hahaha i thought you meant,,, nevermind",2
,,,,,,,,UgjWxryXNXTg73gCoAEC.8L7557oW4Zc8OpMHLh04Mi,amber moin,1 year ago,1508020814928,Joyce Lambert is that young viktor nikiforov i see in your profile pic😏😂😂,0
,,,,,,,,UgjWxryXNXTg73gCoAEC.8L7557oW4Zc8eR7v9IrC4a,Isabelle Lourenco,6 months ago,1523745614930,I am in love with her voice.,1
UggXwmwqC-N4m3gCoAEC,Spookpy,1 year ago,1508020814525,I miss this Melanie😔,0,false,0,,,,,,
UginSCN1J_fMu3gCoAEC,User Us,1 year ago,1508020814528,I love her voice❤💦,11,false,0,,,,,,
Ughv2IyTAF73JXgCoAEC,Nik Golič,1 year ago,1508020814531,was this her before she got into albums?,184,true,5,,,,,,
,,,,,,,,Ughv2IyTAF73JXgCoAEC.8L-PbT3vJ_V8L0KCZ6V_Lo,Lauren QUEE,1 year ago,1508020814968,Nik Golič  yes,12
,,,,,,,,Ughv2IyTAF73JXgCoAEC.8L-PbT3vJ_V8LYrKQWpjZk,Heidi Woody,1 year ago,1508020814970,Nik Golič well no jk yes,4
,,,,,,,,Ughv2IyTAF73JXgCoAEC.8L-PbT3vJ_V8NlBqqF7NZu,hobi hobi,1 year ago,1508020814972,Nik Golič Yeah she was little when she preformed then a couple years she wanted to sing again.,6
,,,,,,,,Ughv2IyTAF73JXgCoAEC.8L-PbT3vJ_V8QjETBXq1ms,Swag Kitty,1 year ago,1508020814973,Nik Golič yes I love these performances and her albums,1
,,,,,,,,Ughv2IyTAF73JXgCoAEC.8L-PbT3vJ_V8SBmaqf7TqS,Lyds lou10,1 year ago,1508020814978,Iggy Is fine ikr she is probably the most successful person off of the voice that I've seen and she's also my idol,0
UghD886uJnp8WHgCoAEC,Sara,1 year ago,1508020814537,I love her,4,false,0,,,,,,
UgjHLWBPWVUnOXgCoAEC,shUT UP HEATHER,1 year ago,1508020814539,Her voice is so good!,0,false,0,,,,,,
UggdW-DNN0HpIXgCoAEC,Glammy Grammy,1 year ago,1508020814542,why is everything about her so fucking perfect,27,true,3,,,,,,
,,,,,,,,UggdW-DNN0HpIXgCoAEC.8KyFZVnHEUd8MEuHHhzjVY,ღTuned Awesomeღ,1 year ago,1508020814989,trinity boone IDFK,1
,,,,,,,,UggdW-DNN0HpIXgCoAEC.8KyFZVnHEUd8MPkYCsr2zM,Xoxo. Hinny,1 year ago,1508020814991,trinity boone. Ikr she's awesome,5
,,,,,,,,UggdW-DNN0HpIXgCoAEC.8KyFZVnHEUd8Mg5JurDODt,Kawiiapie Life,1 year ago,1508020814992,trinity boone iKR,0
UgirUHi3Xj4rsXgCoAEC,Anne Bicth,1 year ago,1508020814563,tem cry babyes aqui?,10,true,2,,,,,,
,,,,,,,,UgirUHi3Xj4rsXgCoAEC.8Kuw212yuOE8LONvSFh3da,Teen Idle,1 year ago,1508020814998,Claro mona,0
,,,,,,,,UgirUHi3Xj4rsXgCoAEC.8Kuw212yuOE8LYrPJKLWHq,Heidi Woody,1 year ago,1508020814999,cassia biby yolo hi,0
UgjVZXKuDdFQUXgCoAEC,The Truth,1 year ago,1508020814566,"I love her singing this song, she loods stunning too💗💖",244,true,5,,,,,,
,,,,,,,,UgjVZXKuDdFQUXgCoAEC.8KumEGSCejY8L9nIAMWxrP,Zaneshadownight 1112,1 year ago,1508020815036,The Truth agreed,1
,,,,,,,,UgjVZXKuDdFQUXgCoAEC.8KumEGSCejY8N1akbhnilO,Ava Raske,1 year ago,1508020815038,The Truth - loods? 😂,3
,,,,,,,,UgjVZXKuDdFQUXgCoAEC.8KumEGSCejY8NS9mA6zqfZ,Crybabies 235,1 year ago,1508020815040,The Truth yap,0
,,,,,,,,UgjVZXKuDdFQUXgCoAEC.8KumEGSCejY8NSBYikHgqU,The Truth,1 year ago,1508020815041,Ava Catherine06 looks 😊,1
,,,,,,,,UgjVZXKuDdFQUXgCoAEC.8KumEGSCejY8eR7yQzdFYR,Isabelle Lourenco,6 months ago,1523745615043,I love her singing this song.,1
UggP_vTatGMzDXgCoAEC,I'd last 5 Seconds without Calum Hood,1 year ago,1508020814569,her performances are incredible,12,false,0,,,,,,
UgjOzkyiii9K_HgCoAEC,Linda Collazo,1 year ago,1508020815857,Is it just me or is Melanie Martinez is so beautiful 😍,17,true,4,,,,,,
,,,,,,,,UgjOzkyiii9K_HgCoAEC.8Kl73U1p_LR8LJG_fJcdgL,paulastoleyobich !,1 year ago,1508020816296,NO!! SHE REALLY IS STUNNING!!,4
,,,,,,,,UgjOzkyiii9K_HgCoAEC.8Kl73U1p_LR8LL_B9kzWtd,Elodia Blood,1 year ago,1508020816298,Yeah !,0
,,,,,,,,UgjOzkyiii9K_HgCoAEC.8Kl73U1p_LR8MFfnRVuRgc,Ania LPS Y AJ,1 year ago,1508020816300,she is,0
,,,,,,,,UgjOzkyiii9K_HgCoAEC.8Kl73U1p_LR8Od20M_gbZp,Lily LeStrange,1 year ago,1508020816302,She is so gorgeous ugh,0
UgjcyVEewCnabXgCoAEC,official teddybear,1 year ago,1508020815861,Her voice is too amazing!✨✨,12,false,0,,,,,,
UgjHxyOV-IlXDngCoAEC,Savannah,1 year ago,1508020815863,i wish she would go back and preform...... <3,11,false,0,,,,,,
Ugjs8wdCAm9OlHgCoAEC,Ririko,1 year ago,1508020815867,"My goal is to hit 20 subscribers and 75 views 
If you watched and subscribed you'll make a someone's dream come true",0,false,0,,,,,,
Ugj4SZ5CTAtuEXgCoAEC,happy night mime,1 year ago,1508020815869,Fetus,0,false,0,,,,,,
UggSxYEJlxf9z3gCoAEC,TheJacelynnShow,1 year ago,1508020815871,Melanieee babe,6,false,0,,,,,,
Ugg8lA676GMCl3gCoAEC,britter the critter,1 year ago,1508020815874,"There were some flaws in her singing (then again who am I to judge, I sound like a dying cat when I ""sing"") but she's learned and changed so much, now she sounds beautiful 
She has such a unique voice, it always gives me chills",1,false,0,,,,,,
UghWy7bFnQsOungCoAEC,Eila Alm Skoglund,1 year ago,1508020815876,I LOVE HER VOICE!!!,9,false,0,,,,,,
UggheNzZtRUSeXgCoAEC,floflo dolls,1 year ago,1508020815878,Quand on sait que maintenant elle fais ses propres chaons moi j'pense qu'elle mérites d'etre a la place de Jul ou autres connerais a la radio.C'est ma Chanteuse préférée!,9,true,1,,,,,,
,,,,,,,,UggheNzZtRUSeXgCoAEC.8Ka6mKp4Dsu8Lo2xtS6X1z,Nichole Khardas,1 year ago,1508020816228,Moi aussi elle est formidable,0
UgjKomdaGAKOwngCoAEC,ghost _ . _ whispers,1 year ago,1508020815881,I like her outfit,0,false,0,,,,,,
UgjqPuNC5MaufHgCoAEC,Ghost Girl,1 year ago,1508020815884,Her voice is so amazing,0,false,0,,,,,,
UghHy3JZik30sHgCoAEC,why try when you can die?,1 year ago,1508020815886,I feel blessed she done my favourite song,2,false,0,,,,,,
Ugh-S0t112I88HgCoAEC,Gottafall BeforeYouFLY,1 year ago,1508020815888,WHen she did Toxic she looked so innocent xD,0,false,0,,,,,,
UghvGcYbEnDDvHgCoAEC,Marcella sandoval,1 year ago,1508020815891,"blkshdjoshdjskxbdisjbdjdncbienfhdkfbdudkcbhdhdhdjdjdhjfhdjfhfhdjnxhdhhfhfhfhfhfhfhfjfjjfjdjjdjdjdjdjjxjdjdjxjxjhfqobzheksndgisnxgdisjxbsukajshs 
Read more",0,false,0,,,,,,
Uggdni7gpB_G-HgCoAEC,cookie yum yum,1 year ago,1508020815893,were those backup dancers just maniques,1,true,1,,,,,,
,,,,,,,,Uggdni7gpB_G-HgCoAEC.8KRlvKQLcsk8LX3VSuThC5,Caitlynn Henson,1 year ago,1508020816213,Samuel Martinez mannequins,0
UghSBapLuMwamXgCoAEC,Samantha,1 year ago,1508020815896,this is definitely the song made for her,11,false,0,,,,,,
UghJ5v9iPfl69ngCoAEC,charlotte rist,1 year ago,1508020815898,"love this girl 
i love her music",2,true,1,,,,,,
,,,,,,,,UghJ5v9iPfl69ngCoAEC.8KMIiZDV2BG8LYrVX3EF2g,Heidi Woody,1 year ago,1508020816286,charlotte rist same,0
Ugj1ipbgK83x13gCoAEC,mochi moo,1 year ago,1508020815901,Holy shitttt... Look where she's at now!! One of my favorite singers. Her voice sends chills through my body; it's so soft and beautiful. Damn guys just look how far she's gotten! I'm so proud to be a cry baby😂😭💕,0,false,0,,,,,,
UggQSf8wkRPhnngCoAEC,SweetSong,1 year ago,1508020815904,sitting down makes your singing worse...that's why she sounds bad.,9,true,13,,,,,,
,,,,,,,,UggQSf8wkRPhnngCoAEC.8KJwb33-Ctj8KOPKyfzdEE,Curry,1 year ago,1508020816508,The point of the couches is to find good (not amazing but good) singers and make them better,0
,,,,,,,,UggQSf8wkRPhnngCoAEC.8KJwb33-Ctj8KOSIUGEDFU,darren nguyen,1 year ago,1508020816510,Queen Curry Tastic why do you have to spam all the comments with this reply lmao stop,2
,,,,,,,,UggQSf8wkRPhnngCoAEC.8KJwb33-Ctj8Kwr8ZE1GJD,Natalie Serh,1 year ago,1508020816512,Ever song She probably sounds better than you though...,0
,,,,,,,,UggQSf8wkRPhnngCoAEC.8KJwb33-Ctj8LOeV3b2qo-,Ta' Leyah Thomas,1 year ago,1508020816514,try me....,0
,,,,,,,,UggQSf8wkRPhnngCoAEC.8KJwb33-Ctj8LZnXCUlUid,Jordan Peckham,1 year ago,1508020816516,"It wasn't an insult, it was defending her. You misunderstood Ever song's intentions.",2
,,,,,,,,UggQSf8wkRPhnngCoAEC.8KJwb33-Ctj8L_61ArmgIX,Curry,1 year ago,1508020816518,@darren nguyen Cause I can :3,0
