id,user,date,timestamp,commentText,likes,hasReplies,numberOfReplies,replies.id,replies.user,replies.date,replies.timestamp,replies.commentText,replies.likes
UgyQllcX8HguCcyOaIt4AaABAg,Codehan,3 weeks ago,1537461544713,"To all Haters: He is an authentic artist who has his own unique style and not a cheap copy. Many people can sing along to a song, but only a few can make a song their own.",0,false,0,,,,,,
UgyGWJuPBwBhX77WcSN4AaABAg,Moïse Fitzgerald,5 months ago,1526056744715,You are a genius!!!!,0,false,0,,,,,,
Ugzh6yaO9XawBfzDlqN4AaABAg,Anthony Honciano,5 months ago,1526056744718,I think he out did himself in the audition,0,false,0,,,,,,
UgzIWVO0LQ32Ouq7Wcd4AaABAg,tjz official,5 months ago,1526056744720,Nice arrangement. Nice vocals. No range. Not much power. Lose the piano and sing man!! Lol,0,false,0,,,,,,
UgzFdtcBH4fb3jjXl3x4AaABAg,Adi Stanciu,5 months ago,1526056744722,Americans only like cute dolls. Great singers will never win the voice. Only young dolls or blue eyed studs. This is more of a miss/mister contest than a voice contest. This guy is awesome.,1,false,0,,,,,,
Ugz96EKRqe7ZCZo8rOJ4AaABAg,Syafiq Saad,5 months ago,1526056744724,His so boring lorhhh..,0,false,0,,,,,,
Ugw5DtnAZO-ijWpV5Hh4AaABAg,LocalBallerz,5 months ago,1526056744726,Studio Version?,0,false,0,,,,,,
UgyUm5YOhPO7luIxz694AaABAg,D M. Butler,5 months ago,1526056744728,Falsetto is better than his normal voice. If he was to sing in his normal voice horrible. But falsetto yes,0,false,0,,,,,,
Ugy6boCZK5zMBGZsvjV4AaABAg,bill newman,5 months ago,1526056744730,"I believe one of the main reasons that there were so many dislike is because of that mess on his head. Who told him that that is attractive? In performance the visual is as important as the auditory. He has a good voice, but he will never get anywhere with that donut on his head. It looks absurd.",0,false,0,,,,,,
Ugzs-2HySTbpp-xBybJ4AaABAg,Mini Theusin,5 months ago,1526056744732,"Ele só fica na porcaria  do piano e falsete, não mostra o outro lado da voz  que tem etc...",0,false,0,,,,,,
UgwTKrykAfo6OepCA5Z4AaABAg,Vered Cohen,5 months ago,1526056744734,Can't believe he's NOT at the top 12,3,false,0,,,,,,
Ugzgv5_aO4ulZ1vy6qd4AaABAg,Susana Duenas,5 months ago,1526056744736,people are so mean,2,false,0,,,,,,
UgzENOdIgasZoNlPME14AaABAg,valentina B,5 months ago,1526056744738,"The problem is not that he is boring because he uses the piano, the problem is that you all stupids can’t appreciate his voice, he is like one of the best of this season",3,false,0,,,,,,
UgxHZrsAEQAc7KIPFal4AaABAg,Donald Pait,5 months ago,1526056744740,Omg his my favorite but the song choice is not good at all 😔😔😔its not fit to him at all 😔,0,false,0,,,,,,
Ugy4JaAxf3-iTBKFUJB4AaABAg,Crishy Bates,5 months ago,1526056744742,Liked him better this time but not the arrangement of this song!,0,false,0,,,,,,
UgzelK0U5yGUGEuLdJ14AaABAg,Derry Dionne,5 months ago,1526056744744,"Terrence is technically one of the best singers this season, but his song selections were poor considering the audiences he sings for the votes and all. The Voice viewers don't care about technique, artistry, or stuff like that. They want to hear something different each week. They just want to be ""surprised"". It's a TV after all.

But anyway, I enjoyed his genuine and creative performances especially his blind and I'm looking forward for his next thing. Keep going on, mate.",0,false,0,,,,,,
UgxCa9n_Z56kF_FItbt4AaABAg,Sharara Ibrahim,5 months ago,1526056744746,He might be hiding behind his piano but he is doing his own  thing and that's what is important as an Artist. Artists like him are not for competitions like the Voice. Cristiana is my favorite but Terrence is exeptional! He's the kind of artist one needs to have a taste for. All the best Terrence for your future endavours as an Artist!,4,false,0,,,,,,
UgwhjkDEvSwbyHUdgH54AaABAg,Raouf MORSI,5 months ago,1526056744748,does he pay to stay ?,0,false,0,,,,,,
UgyDHtziNjRFi0WQ1494AaABAg,Gunner 1985,5 months ago,1526056744750,Same thing he keeps doing ...,0,false,0,,,,,,
UgzG210Ey3OwUf5HTf94AaABAg,Fred Perry,5 months ago,1526056744752,"Dude, cut that falsetto. It became annoying lol",0,false,0,,,,,,
UgzXjYz5HEQ9I9W3TMd4AaABAg,Yolalicious,5 months ago,1526056745332,i'd go to see one of his performances. he's super talented.,2,false,0,,,,,,
UgztWi6fiN6fMFQfct54AaABAg,M M,5 months ago,1526056745335,Wtf with all the hate hahaha,0,false,0,,,,,,
UgwGMbzR5GGIZwXm4Ot4AaABAg,virginia knox,5 months ago,1526056745338,Terrence is awesome! This is 'grown folks' music! No need to run around on the stage to impress. Great voice and presence on stage!,3,false,0,,,,,,
UgzBVmLO_wNB8HBUOu54AaABAg,zuna bukosi,5 months ago,1526056745341,The most skillful and talented artist is the show is gone...sad for days :(,2,false,0,,,,,,
Ugxr8QtGdYfxXBzq4AN4AaABAg,MrCarrottCake100,5 months ago,1526056745344,Bring Terrence baaack!  He is so special.  He lights the air on fire when he plays.,2,false,0,,,,,,
UgxGXvysRUOmksiDkml4AaABAg,ZARAH G,5 months ago,1526056745346,Please sing with out the piano  next time,0,false,0,,,,,,
Ugy7mXTXiZnVyh_UW0Z4AaABAg,John Pitre,5 months ago,1526056745348,Unfortunately only real musicians can appreciate this!,5,true,1,,,,,,
,,,,,,,,Ugy7mXTXiZnVyh_UW0Z4AaABAg.8fFlfLQkKaN8fK8HlyEOno,Sallie Mae,5 months ago,1526056745713,John Pitre .Yes and those who have lived their lives appreciating real music (all genres)and knowing where these music came from.,0
Ugxxy6tckgFL7bZhV6V4AaABAg,Kelvin Pattiasina,5 months ago,1526056745351,can he sing without the piano? why he always sing with the piano? why why why ???,0,false,0,,,,,,
UgyzViYNzHoJVDcYCL54AaABAg,outmazirt outma,5 months ago,1526056745353,I could use his hairdo as an ashtray.,0,false,0,,,,,,
Ugwh-hO0RdQkbsrrvvh4AaABAg,Biddy A,5 months ago,1526056745355,"The show is called ""the VOICE"" not ""THE SHOW"" not ""SO YOU THINK YOU CAN DANCE"" not AMERICAN IDOL it's soely about the voice and y'all cannot deny THIS MAN HAS THE VOICE and as much as u think he does the same thing THE MAJORITY of contestants be doing the same thing: walking on stage with the SAME buildup of vocals waving, high-fiving the audience then Dipping YA HYPOCRITES ITS ALL THE SAME",13,true,1,,,,,,
,,,,,,,,Ugwh-hO0RdQkbsrrvvh4AaABAg.8fFG6017JtV8gZg-9oPHjz,K e i l i s,4 months ago,1528735145887,Biddy A DAT PART!,0
UgxsaOIVutt7Oi5OG5p4AaABAg,Whatever !,5 months ago,1526056745358,This is a mess,0,false,0,,,,,,
UgyAOPwqxgI-z5uXJXN4AaABAg,Alice Daoud,5 months ago,1526056745360,"Oh thank lord. Bye bye bye! 
Sad to see Kelsea go with him.",0,false,0,,,,,,
UgzW9k3hvY8o4z80q-x4AaABAg,Lori IM,5 months ago,1526056745362,Ugh!More of the same from this dude.,0,false,0,,,,,,
Ugy3f3crL9iebgkaDbR4AaABAg,dmfuerte,5 months ago,1526056745364,I am genuinely a fan and enjoy Terrence's music. And I would pay money to see him at a show. But he has Chris Tucker hair from The 5th Element.,0,false,0,,,,,,
UgxXQ8iR_Xc1yc3qRC14AaABAg,The Wanderer,5 months ago,1526056745366,I'm just not necessarily excited about his existence on the show,0,false,0,,,,,,
UgzVz33o5SawVwSxSGN4AaABAg,Mizuka Young,5 months ago,1526056745368,I guess if Elton John and Bob Dylan was on the show they would get voted off as well because they sound the same on every single songs and never taking risks lol but are loved by social media. Terrence is an awesome musician and I will miss him a lot. He did amazing every week and I love it when he didn't take risks. He just needs to use his falsetto more often and he should keep playing piano more often. When he sings it's like meditation kind of music where he is the kind of singer who wants to heal peoples  hearts. He heals my heart and calms me down a lot. But that kind of music is not for The Voice. It's better off for an album instead. I can't wait for him to work on his album as I will buy it. Alicia has the best team ever. And I can't wait for Kelsea to work on her album as well. Alicia will make sure of it and will help all of her team for sure.,3,false,0,,,,,,
Ugw51ZomB6BZkGz0qw94AaABAg,Josephine Fenoglio,5 months ago,1526056745370,"So sorry to see him go!  A great musician with a falsetto that is out of this world, bur not the type of artist for this show which is becoming more and more a shouting competition with people straining their voices and sometimes completely off key!  So sad!",1,false,0,,,,,,
UgyCn_XxBF1-ba2qTdt4AaABAg,MrSpeedo804,5 months ago,1526056745372,A Lounge Singer is all he is. He wouldn't sell out any Arena. Nothing exciting at all.,0,false,0,,,,,,
UgzdBds2i3akYC_OGQ94AaABAg,Chase Sumner,5 months ago,1526056745374,"I don’t get the hate! I understand that there isn’t a lot of variance in his performances, but the dude can SING. His riffs are freaking effortless, he has an amazing tone , and some of the best vocal control on the show right now.",2,false,0,,,,,,
UgwKyPeRxKTStYmW_A94AaABAg,Nenamami brown,5 months ago,1526056745376,superfan excuse me all haters out there wow man,1,false,0,,,,,,
UgxzVh6wRFCY3mNPvCR4AaABAg,Nenamami brown,5 months ago,1526056746713,"aww stay hungry please keep ,the dream alive you are a great one of the best you remind me of brother n it breaks my heart you do you I would love to work with you your perfect just take care not your daughter n live your life I will find you to sing and or hopefully you will sing at my wedding FYI yeah I'm crying I only watched for you my girl beautiful what is your genre of music?",1,false,0,,,,,,
UgyH-ETfPZBhS3L9Vmd4AaABAg,Lynn Coles,5 months ago,1526056746715,I have to question his ability.  Sounds are great but I would​ like to hear a full song by him.,0,false,0,,,,,,
UgzHKRchna3a79cxXjp4AaABAg,S R L,5 months ago,1526056746718,"Bored ... and a little vain, he thought that with his falsetto and his high range did not need anything else.Wrong.",0,false,0,,,,,,
UgyKyyV5a5NN6ZR907N4AaABAg,Stephanie Garilus,5 months ago,1526056746720,I know I get it. He stay behind his piano and blah blah . But tbh the voice doesn’t deserve this guy talent . He could take you up there and bring you right where you were lol with his range . He has so much to  give. Sadly sooner or later he’ll get eliminated simply because It’s out of America’s comfort zone 🤷🏽‍♀️,4,false,0,,,,,,
UgzJm5B0LHZNIn7OAEB4AaABAg,Chic Chika,5 months ago,1526056746722,"he only sing what he like, should be in the competition like this he must sings a song to make many people to vote him.",0,false,0,,,,,,
UgwhMl-c0MTwqRaKUIR4AaABAg,Amanda Busbee,5 months ago,1526056746725,❤️❤️❤️,0,false,0,,,,,,
Ugxwn3G0UeqVbXD_VUp4AaABAg,beanparadox,5 months ago,1526056746727,He needs to do some upbeat Stevie Wonder,0,false,0,,,,,,
Ugx9GlKIMjPqu_REgeZ4AaABAg,Gifty Agyekum,5 months ago,1526056746730,👎,0,false,0,,,,,,
UgzEHGNCiG-T8HdjyIx4AaABAg,Decarlas LLC,5 months ago,1526056746732,Beautiful,0,false,0,,,,,,
Ugw1I64eb1tfVeddcAh4AaABAg,Tom Gillman,5 months ago,1526056746734,"It's not ""hatin'"" to say he hasn't stepped up to the plate.  It's not hatin' to remind him what tore the house down in his first audtion. And it's sure not 'hatin'"" to assert that the playoffs are not the time to experiment or tread lightly or take your fans for granted.  Terrence where's your common sense? Alicia, where were you when Terrence chose this song? PLATY THE STRONG CARD WHEN THEY STAKES ARE HIGH!",0,false,0,,,,,,
UgyuXD30gBi0k4XuIEx4AaABAg,Aguardina Santos,5 months ago,1526056746737,He did is thing since the beginning we want something new from you.,0,false,0,,,,,,
UgxiJ50m0y04HcW-Y114AaABAg,C,5 months ago,1526056746739,"Quite bored with his style. 😑😑😑 same runs, same style in every performance.",0,false,0,,,,,,
UgwQbo_DeuIHtq9aRwF4AaABAg,bnathanb1982,5 months ago,1526056746742,Wow 1.1k likes and 1k dislikes.  Don't see that much on here....,0,false,0,,,,,,
Ugy50HJB3Q9hmB8p5Xl4AaABAg,American Pride,5 months ago,1526056746744,Livia was screwed !!!!!!,0,false,0,,,,,,
UgxZrYsBRfUVrA_dbId4AaABAg,efwin yudha,5 months ago,1526056746745,"yay, he's gone",0,false,0,,,,,,
Ugz9OYQmRCndi0iDg3t4AaABAg,Bada Godwin,5 months ago,1526056746747,"Oh Terrence! Loved u from ur audition, we know u can play the piano and you've got a great voice but can u please compete? This show ain't just about showing what kinda artist u are..... you're gonna go home thinking we'd vote because we like you. Everyone's stepped up except u.",0,false,0,,,,,,
Ugzb8W6IuDPJTT6vDzt4AaABAg,fatchickens,5 months ago,1526056746749,"the donut, the piano, the falsetto. ur good but getting boring sir.",0,false,0,,,,,,
UgwpfOFAEZ33yEeOmpF4AaABAg,Flor Gordillo,5 months ago,1526056746751,His blind auditions was amazing but now he was stuck in a genre. We need to see something more refreshing and creative.,1,false,0,,,,,,
UgzYUXkIQNXkaN52PiZ4AaABAg,Patricia Soneh,5 months ago,1526056746753,"he is a great singer, but..so repetitive. I’m just getting tired of him",0,false,0,,,,,,
UgwOYm0AzaJdLdhI6fR4AaABAg,Mig Nungs,5 months ago,1526056746755,"I couldn't feel anything with this performance! What is happening with this guy? He was my favorite, but he started to be boring, it is a pity and I feel sorry     

:  s",0,false,0,,,,,,
Ugw_65bW5xDOlzM62z14AaABAg,Brian Bartolovich,5 months ago,1526056747313,I would have loved to have heard him sing “Dear Theodosia”. Would have taken me back to his more softer side which I fell in love with in “My Girl” and “Stars”,0,false,0,,,,,,
UgxDdjlv4P3crYp5Nsd4AaABAg,the greatest,5 months ago,1526056747315,"Terrance is an fantastic artist! His style reminds me of one the greatest artist of all time, PRINCE! Prince used his guitar  to ""hide behind"". That was his medium of choice. Didn't make him less of an artist and he was hugely successful. Terrance has that same ability to create, to perform, and to deliver his music ""behind a piano""! An artist will make their way onto the music scene, the rest are ""just great singers and won't go anywhere. Think Chris Daughtry, he didn't win his talent contest, but as an artist he wrote his own music, and the rest is history.",2,false,0,,,,,,
UgwOwJv_P1WGGGO5Lgt4AaABAg,Hannah Williams,5 months ago,1526056747317,you are amazing and i love you,1,false,0,,,,,,
UgwEablfNMmKQUtJl194AaABAg,kmfa trt,5 months ago,1526056747319,Sicka he!,0,false,0,,,,,,
UgweAhMAyFY5CFOScYd4AaABAg,Valerie M,5 months ago,1526056747322,I think he's loosing it :( He needs to step up his game and sing outside the box.,2,false,0,,,,,,
UgwqutyNVheaopepfDR4AaABAg,Lynn Daniel,5 months ago,1526056747324,"Why so many dislikes, that's a bit much. 🙄🙄",1,false,0,,,,,,
UgxnDccB3klTIlC5x7V4AaABAg,Sara B.,5 months ago,1526056747326,Andd he's out,0,false,0,,,,,,
Ugy5Z_FqZYfl90Ycl8l4AaABAg,ascober,5 months ago,1526056747328,I dozed off after the first note.,0,false,0,,,,,,
Ugwy0_5vBJ4oZJQF6H94AaABAg,darien hackett,5 months ago,1526056747330,I really enjoyed his other performances but that song was not for him it dragged him to dull town,0,false,0,,,,,,
Ugyrq_3vJrkOcvz2TbR4AaABAg,Chioma Ubani,5 months ago,1526056747332,This guy should stop hiding behind the piano,0,false,0,,,,,,
Ugx_VqunZyYp8lUZEzF4AaABAg,Shonta Taylor,5 months ago,1526056747334,I love him and his artistry,2,false,0,,,,,,
Ugx0ngPmFIOUvfEUzP54AaABAg,Araya Soleil,5 months ago,1526056747336,Like watching a snore.  Not a fan sorry.,0,false,0,,,,,,
Ugwjb7t78UnfGd76IgB4AaABAg,Anozie Justin,5 months ago,1526056747338,Overrated,0,false,0,,,,,,
UgxCsSeTYcwHiS8ZxhR4AaABAg,ASP1926,5 months ago,1526056747340,Boringggggg!!!!,0,false,0,,,,,,
UgxFC2-0hu7UcolkzTh4AaABAg,Alhekis,5 months ago,1526056747342,chaka khan again?,0,false,0,,,,,,
UgwdeiK1D36feAEwlWl4AaABAg,Max Borker,5 months ago,1526056747345,one trick pony,0,false,0,,,,,,
UgxeucQdEVjnE2d99tx4AaABAg,Snickel Fritz,5 months ago,1526056747347,I dont get this guy at all. He's no Stevie Wonder! And thats what hes going for and its just not hitting the mark. If u really want to judge these people close your eyes and listen to their music and if its not good its not. I work w the music industry and if someone is flat or just not strong theryre not.,0,false,0,,,,,,
UgyFUYPCUAQtaYyJIzV4AaABAg,Rodrigo Curty,5 months ago,1526056747349,Jessie J is making history at China,0,false,0,,,,,,
Ugxu1TYjCTHCJC3HFLZ4AaABAg,Shivani Singla,5 months ago,1526056747351,00:16 oh my heart just came out ❤,0,false,0,,,,,,
UgyKGkXBr6248DF5gA94AaABAg,Matt Kennemer,5 months ago,1526056747353,"Can you say, “one-trick”?",0,false,0,,,,,,
UgzEgazwhnMUTmVNXs14AaABAg,T Russell,5 months ago,1526056748151,I just want to toss little Velcro-strip ping pong balls to see if I can land one in that forehead hair nest.,0,true,1,,,,,,
,,,,,,,,UgzEgazwhnMUTmVNXs14AaABAg.8fBpph2C5yE8fBq8qo3Vls,T Russell,5 months ago,1526056748491,Omg... lol! 😂 https://www.pinkcatshop.com/gam268-poo-head-velcro-ball-head-game.html,0
UgxwQfFPNoK80pd_snh4AaABAg,LITMRomeo,5 months ago,1526056748155,I disliked solely because Alicia is saving him instead of Christiana.,0,true,1,,,,,,
,,,,,,,,UgxwQfFPNoK80pd_snh4AaABAg.8fBoS3wKFEs8fCS6DJJXHH,?,5 months ago,1526056748556,LITMRomeo CHRISTIANA MADE IT,0
Ugy978wD_antIAtMajR4AaABAg,Rion Johnson,5 months ago,1526056748158,"I haven't really been following, but I did this guy's very first performance and thought it was great.  This was just boring :/",0,false,0,,,,,,
UgxOZ6BFevokxy8AOQx4AaABAg,Diogo Luz,5 months ago,1526056748161,Boring,0,false,0,,,,,,
UgzKaO7gZr_Rf_wDdy94AaABAg,Eric Bank,5 months ago,1526056748164,"While the talent is evident, Terrence needs to break out of his comfort zone and find a song he can just sing straight up!!! We all know he has remarkable range and a great falsetto --- but --- it's getting old. Sing something clean, so we know you have something more to give!!!",0,false,0,,,,,,
UgytCw5g9MogXP5yupR4AaABAg,Vinícius Wash B. Teodoro,5 months ago,1526056748166,"Alicia won't save him guys ... 
not this time 
Jackie will be the most voted and Alicia will pick , probably, Christiana or Kelsea",0,false,0,,,,,,
Ugz_QDU86EEqKkOFoip4AaABAg,Sancho Pancho Sancho,5 months ago,1526056748169,"Go see Ibeyi's cover, so much better !",0,false,0,,,,,,
UgzFXnsDrQFMTKD2-xB4AaABAg,nicolas,5 months ago,1526056748171,I LOVE HIM but now that Jackie will inevitably get saved he needs to go #TeamChristiana,0,false,0,,,,,,
Ugx28Gr8s6ZFg6PruP14AaABAg,Elena Atanasova,5 months ago,1526056748174,"I don't get all the hate... like really people? Why have to be so mean? Everyone on team Alicia is amazing. Yes, we all have our favourites, but this doesn't mean we should put the others down. This guy has talent and a great voice. I agree that he should step out of his comfort zone and do something different... But all the comments about his hairstyle are just unnecessary",1,false,0,,,,,,
UgwWrXuS8AfdU5jUfJd4AaABAg,Americas Shay,5 months ago,1526056748177,🔥🔥🔥🔥,1,false,0,,,,,,
UgwXIAH5yjVz-4paYwN4AaABAg,bariq azmi,5 months ago,1526056748180,Sharayah did better than this,0,false,0,,,,,,
UgwEyTaO1vmLWuOJxyR4AaABAg,mjr3112,5 months ago,1526056748182,"Omg the like-dislike ratio is the same!!’! Tbh he didn’t step it up, which is disappointing because with some good coaching he’d be as good as Chris Blue. Which two do you want to go through? I’m hoping Jackie and Christiana.",1,false,0,,,,,,
UgweChQz6B2GExPZKqZ4AaABAg,glacie mae magsombol,5 months ago,1526056748185,Can't he stand while singing? Lol,0,false,0,,,,,,
UgwxjfR56LvRTy66dVt4AaABAg,Francis B,5 months ago,1526056748189,"I'm so sick of seeing him behind the piano, hitting the same runs over and over...He is not a very experienced singer as some thought. This was definitely not a good song choice as well.",0,false,0,,,,,,
Ugww_MakFUCqmropE2t4AaABAg,Mom2William,5 months ago,1526056748191,He wow'd everyone in the Blinds but he has gotten boring. Sorry. He has an amazing voice but you just know that you are going to hear the same thing every time.,0,false,0,,,,,,
UgynqvMCBvSjYhSlmGd4AaABAg,YoureNotTheOne,5 months ago,1526056748194,"This guy is obviously talented. Unfortunately, up to this point, everything from him has sounded very much the same. Though I fully expect his coach to push him through, if he doesn't show something more, he won't last long, once voting falls exclusively to the viewers.",0,false,0,,,,,,
UgxcMxmQq4ktwTdX0u14AaABAg,Aim Muhammad R,5 months ago,1526056748197,I can tell he's too overrated since the blind audition.,0,false,0,,,,,,
UgwKAo0H6CVIzU2KwqV4AaABAg,Zaccary Lee,5 months ago,1526056748200,Sooooooooooooooooooooo........ Generic and boring....very overrated..,0,false,0,,,,,,
Ugzwn_v7BdUQLljmcMB4AaABAg,Mega Gumelar,5 months ago,1526056748202,Sarayah sang this song better ~,0,false,0,,,,,,
UgxbGSFFEXJ-UMjeLdB4AaABAg,Margherita Cappa,5 months ago,1526056748205,"Albano, per favore vai viaaaa",0,false,0,,,,,,
UgyXRKJv8vzITV6-cgR4AaABAg,"Seun Ajayi, Nigerian",5 months ago,1526056749204,"I see comments defending and castigating Terrence for staying behind the piano all the time but let's be honest with ourselves and one another, he NEEDS to get up from that piano like YESTERDAY! Alicia should know this so why isn't she saying or doing anything? She's versatile, sometimes on the piano, sometimes not. She doesn't stay on it ALL THE TIME. He needs to surprise people, move around, be suave. We get it, he has artistry, bla bla bla, but seriously, add some diversity. Even Michael Jackson didn't do moonwalks all the time. Having said that, good performance.",0,false,0,,,,,,
Ugy6bg79lguV69GwIkF4AaABAg,Skyler White,5 months ago,1526056749206,so boring same performance everytime,0,false,0,,,,,,
UgyGX27sYvslweSV7At4AaABAg,Eric Smith,5 months ago,1526056749208,The voice is seriously training us to look at these artists the wrong way.,1,false,0,,,,,,
Ugz8wkL8ZM9pRfVBpK14AaABAg,fairalways,5 months ago,1526056749210,"No, he's not going to win The Voice. I don't care. Those are some SLAMMIN renditions. If I'm in my car and I want that vibe, I'm putting in his CD along with some Frankie Beverly and some Luther. The rest a' y'all can put in your CD of whatever.",4,false,0,,,,,,
UgwQxCgk0E5ZAb4WlPV4AaABAg,Giovanna Farigu,5 months ago,1526056749212,"I LOVE TERRENCE. I want to buy his CD as soon as it comes out. What a FANTASTIC musician and artist!! Love, love, love, love and more love to you Terrence.",5,false,0,,,,,,
UgxzSU_2JJYhNJrFZJB4AaABAg,foyani,5 months ago,1526056749213,"Never get why the coaches are crazy over him, especially this performance, he's trying too hard to be unique with all those runs",0,true,1,,,,,,
,,,,,,,,UgxzSU_2JJYhNJrFZJB4AaABAg.8fBKXSKxz418fBTwb2zF79,LocalBallerz,5 months ago,1526056749526,foyani not really trying st all,0
UgwCzpo3m9JC014c8pV4AaABAg,Erika Seleste Vasquez,5 months ago,1526056749216,Wow that,0,false,0,,,,,,
UgxdNgywOIb_RkgCppZ4AaABAg,BroMike,5 months ago,1526056749218,"Personally, the arrangement feels a bit off.",0,false,0,,,,,,
UgwjNy0bsiYoJAxJbOR4AaABAg,Jamie Lyons,5 months ago,1526056749219,I used to love Terrance in the blinds.. But now he stays the same :(,0,false,0,,,,,,
Ugzic1w_KwJm4CQ2Ych4AaABAg,William Z,5 months ago,1526056749221,"Pros: 
-crazy range

Cons: 
-boring
-hides behind his falsetto instead of using it to compliment his performance
-has a sphincter on his forehead",0,false,0,,,,,,
UgzfeEm17rhOKpp_1nF4AaABAg,Bee Gee,5 months ago,1526056749223,borrrrringgg,0,false,0,,,,,,
UgxfutcSz4PZ4hrgJLR4AaABAg,DFOJAIX fojaix,5 months ago,1526056749224,No no no no pls...song selection.......pls.kindly sing all night long sonu can play with melodie...this jazz is out ...credit goes to the muzick not the singer....he done well i know that but...this is a competition? I mean jazz?????i know jazz is higher learning skill all the deal in it? But Come on!!! ..this contestent song selection is out!! .tq frm Malaysia,0,false,0,,,,,,
UgyI97SUH93RbIxbYoh4AaABAg,Mason Fickbohm,5 months ago,1526056749226,"I got tired of his performances after the second one because I just knew that every single one would be him playing the piano, singing a slow song, and continuously hitting the same high notes",0,false,0,,,,,,
Ugy-eRXVD2mjKYyzC0x4AaABAg,Andy Tanjaya,5 months ago,1526056749228,Boring,0,false,0,,,,,,
UgxKBm6-q7YjjrAoQ5l4AaABAg,Ken,5 months ago,1526056749230,Who else is over him? I'm never excited about his performances. He can go home now.,0,false,0,,,,,,
Ugxg1A-7UK_koAA5d-14AaABAg,E. G,5 months ago,1526056749231,Mds esse cara é chato demais,0,false,0,,,,,,
UgycBSAcPotQwtEcFkx4AaABAg,Enifome Okeze,5 months ago,1526056749233,Please do something new....tired of the piano,0,false,0,,,,,,
UgwbpeBuhN45WvNXLFp4AaABAg,Yedda Oliveira,5 months ago,1526056749235,TALENT 💜,0,false,0,,,,,,
UgyT-VUBrXrEiG21sRJ4AaABAg,Bituin A.,5 months ago,1526056749237,"Someone give Terrence a recording deal already! He's so ready to go on tour, too.",2,false,0,,,,,,
UgyCmWqzaCHvz5V645h4AaABAg,RMF4tez,5 months ago,1526056749238,I really just want to hear his belting voice for one performance. He has been hiding behind his falsetto and piano for too long now. I get that that is where he is most comfortable but it’s time to step out of that comfort zone,0,false,0,,,,,,
Ugyrxxud0_Z7s0rMePN4AaABAg,João Victor Lopes,5 months ago,1526056750300,Chistiana is better,0,false,0,,,,,,
Ugwnct9FVpN8DIXzcVx4AaABAg,Dhaminic Maleger,5 months ago,1526056750301,"We loved Noah Mac and wanted so much justice for him last season and that's because he was unique and did something new every time he was onstage, and I'm not saying that Terrence isn't unique, but rather after his knockout rounds, his style of performing (the insane falsetto runs and piano arrangements) got a little bit stale. So unless he intentionally wants to get out, he has to do something new and for Christ's sake, get off that piano!",0,false,0,,,,,,
